{
  "$schema": "https://json-schema.org/draft/2020-12/schema",
  "$id": "https://chopshop.local/schemas/task.enqueued.schema.json",
  "title": "task.enqueued",
  "type": "object",
  "required": [
    "v",
    "id",
    "seq",
    "ts",
    "machine",
    "project",
    "type",
    "severity",
    "needs",
    "subject",
    "cause",
    "body"
  ],
  "properties": {
    "v": {
      "const": 1
    },
    "id": {
      "type": "string",
      "pattern": "^[0-7][0-9A-HJKMNP-TV-Z]{25}$"
    },
    "seq": {
      "type": [
        "integer",
        "null"
      ]
    },
    "ts": {
      "type": "string",
      "pattern": "^\\d{4}-\\d\\d-\\d\\dT\\d\\d:\\d\\d:\\d\\d(\\.\\d{1,6})?Z$"
    },
    "machine": {
      "type": "string",
      "minLength": 1
    },
    "project": {
      "type": "string",
      "minLength": 1
    },
    "type": {
      "const": "task.enqueued"
    },
    "severity": {
      "enum": [
        "info"
      ]
    },
    "needs": {
      "const": null
    },
    "subject": {
      "type": "object",
      "required": [
        "kind",
        "id"
      ],
      "properties": {
        "kind": {
          "const": "task"
        },
        "id": {
          "type": "string",
          "pattern": "^q:[0-7][0-9A-HJKMNP-TV-Z]{25}$"
        },
        "title": {
          "type": [
            "string",
            "null"
          ]
        },
        "url": {
          "type": [
            "string",
            "null"
          ]
        }
      }
    },
    "cause": {
      "type": "object",
      "required": [
        "id",
        "depth"
      ],
      "properties": {
        "id": {
          "anyOf": [
            {
              "type": "string",
              "pattern": "^[0-7][0-9A-HJKMNP-TV-Z]{25}$"
            },
            {
              "type": "null"
            }
          ]
        },
        "depth": {
          "type": "integer",
          "minimum": 0,
          "maximum": 3
        }
      }
    },
    "body": {
      "type": "object",
      "required": [
        "task",
        "employee",
        "title",
        "position",
        "by"
      ],
      "properties": {
        "task": {
          "type": "string",
          "pattern": "^q:[0-7][0-9A-HJKMNP-TV-Z]{25}$"
        },
        "employee": {
          "type": "string",
          "pattern": "^[^/\\s]+/[0-9]+/[a-z0-9][a-z0-9_-]{0,31}/[0-9]+$"
        },
        "title": {
          "type": "string",
          "minLength": 1
        },
        "position": {
          "type": "integer",
          "minimum": 0
        },
        "by": {
          "type": "string",
          "minLength": 1
        },
        "trigger": {
          "type": [
            "string",
            "null"
          ]
        },
        "enqueued_at": {
          "type": "string",
          "pattern": "^\\d{4}-\\d\\d-\\d\\dT\\d\\d:\\d\\d:\\d\\d(\\.\\d{1,6})?Z$"
        }
      }
    }
  }
}
